{
 "address": null,
 "amenities": {
  "convenience_store": {
   "confidence": "medium",
   "distance_m": 400,
   "method": "osm",
   "name": "7-Eleven",
   "source": "https://www.openstreetmap.org/way/994896927",
   "value": true,
   "verified_at": "2026-10-12"
  },
  "drinking_water": {
   "confidence": "low",
   "distance_m": null,
   "method": "osm",
   "source": "https://www.openstreetmap.org/way/1291192404",
   "value": null,
   "verified_at": "2026-10-12"
  },
  "station": {
   "confidence": "low",
   "distance_m": null,
   "method": "osm",
   "name": null,
   "source": "https://www.openstreetmap.org/way/1291192404",
   "value": null,
   "verified_at": "2026-10-12"
  },
  "toilet": {
   "changing_table": null,
   "confidence": "low",
   "distance_m": null,
   "method": "osm",
   "note": "300m 內沒有登記或標示的公廁；不代表沒有",
   "source": "https://www.openstreetmap.org/way/1291192404",
   "value": null,
   "verified_at": "2026-10-12"
  }
 },
 "area_m2": 9439,
 "best_shade_windows": {
  "1": null,
  "10": null,
  "11": null,
  "12": null,
  "2": null,
  "3": null,
  "4": null,
  "5": null,
  "6": null,
  "7": null,
  "8": null,
  "9": null
 },
 "charger_summary": {
  "fast": 0,
  "nearest_any_m": null,
  "nearest_fast_m": null,
  "nearest_slow_m": null,
  "radius_m": 500,
  "slow": 0,
  "total": 0,
  "unknown": 0
 },
 "chargers": [],
 "daytime_shaded_share": 0.0,
 "geometry_estimated": false,
 "id": "ty-w1291192404",
 "indoor": false,
 "kind": "park",
 "level": "none",
 "level_label": "大多曝曬",
 "location": {
  "lat": 25.0354,
  "lng": 121.070453
 },
 "name": "公園（近桃科一路）",
 "name_source": "nearest_street",
 "official": null,
 "osm": {
  "id": 1291192404,
  "type": "way",
  "url": "https://www.openstreetmap.org/way/1291192404"
 },
 "park_name": null,
 "parking": [
  {
   "access": null,
   "capacity": null,
   "capacity_disabled": null,
   "capacity_parent": null,
   "distance_m": 387,
   "distance_method": "straight_line",
   "fee": null,
   "kind": "surface",
   "kind_label": "平面停車場",
   "location": {
    "lat": 25.030962,
    "lng": 121.069914
   },
   "maxheight_m": null,
   "method": "osm",
   "name": "7-ELEVEn 大益門市停車場",
   "opening_hours": null,
   "operator": null,
   "osm": {
    "id": 994896928,
    "type": "way",
    "url": "https://www.openstreetmap.org/way/994896928"
   },
   "verified_at": "2026-10-12"
  },
  {
   "access": null,
   "capacity": null,
   "capacity_disabled": null,
   "capacity_parent": null,
   "distance_m": 588,
   "distance_method": "straight_line",
   "fee": null,
   "kind": null,
   "kind_label": "停車場",
   "location": {
    "lat": 25.040887,
    "lng": 121.072598
   },
   "maxheight_m": null,
   "method": "osm",
   "name": "停車場",
   "opening_hours": null,
   "operator": null,
   "osm": {
    "id": 1102607211,
    "type": "way",
    "url": "https://www.openstreetmap.org/way/1102607211"
   },
   "verified_at": "2026-10-12"
  },
  {
   "access": null,
   "capacity": null,
   "capacity_disabled": null,
   "capacity_parent": null,
   "distance_m": 752,
   "distance_method": "straight_line",
   "fee": null,
   "kind": "surface",
   "kind_label": "平面停車場",
   "location": {
    "lat": 25.0287,
    "lng": 121.066853
   },
   "maxheight_m": null,
   "method": "osm",
   "name": "平面停車場",
   "opening_hours": null,
   "operator": "萊爾富觀音高潭店停車場",
   "osm": {
    "id": 994896930,
    "type": "way",
    "url": "https://www.openstreetmap.org/way/994896930"
   },
   "verified_at": "2026-10-12"
  },
  {
   "access": "yes",
   "capacity": 10,
   "capacity_disabled": null,
   "capacity_parent": null,
   "distance_m": 777,
   "distance_method": "straight_line",
   "fee": "no",
   "kind": "surface",
   "kind_label": "平面停車場",
   "location": {
    "lat": 25.040792,
    "lng": 121.07598
   },
   "maxheight_m": null,
   "method": "osm",
   "name": "平面停車場",
   "opening_hours": null,
   "operator": null,
   "osm": {
    "id": 987281835,
    "type": "way",
    "url": "https://www.openstreetmap.org/way/987281835"
   },
   "verified_at": "2026-10-12"
  }
 ],
 "playground": {
  "equipment": [],
  "fee": null,
  "max_age": null,
  "min_age": null,
  "opening_hours": null,
  "surface": null,
  "wheelchair": null
 },
 "playground_mapped": false,
 "rain_cover": {
  "confidence": "low",
  "covered_area_m2": 0,
  "covered_ratio": 0.0,
  "method": "osm",
  "note": "OSM 未標示覆蓋此處的高架或屋頂；未實地驗證",
  "source": "https://www.openstreetmap.org/way/1291192404",
  "value": false,
  "verified_at": "2026-10-12"
 },
 "region": {
  "city": "桃園市",
  "district": "觀音區",
  "id": "taoyuan"
 },
 "shade_timetable": {
  "building_height_known_share": 0.0,
  "buildings_considered": 21,
  "confidence": "low",
  "method": "computed",
  "note": "依 OSM 建物高度/樓層、高架、屋頂、樹木與太陽位置推算（每月 15 日）；未計地形與臨時遮蔽",
  "slot_minutes": 30,
  "slot_start": "06:00",
  "slots": {
   "1": [
    null,
    null,
    0.15,
    0.0,
    0.0,
    0.0,
    0.0,
    0.0,
    0.0,
    0.0,
    0.0,
    0.0,
    0.0,
    0.0,
    0.0,
    0.0,
    0.0,
    0.0,
    0.0,
    0.0,
    0.0,
    0.0,
    null,
    null
   ],
   "10": [
    0.29,
    0.02,
    0.0,
    0.0,
    0.0,
    0.0,
    0.0,
    0.0,
    0.0,
    0.0,
    0.0,
    0.0,
    0.0,
    0.0,
    0.0,
    0.0,
    0.0,
    0.0,
    0.0,
    0.0,
    0.0,
    0.0,
    null,
    null
   ],
   "11": [
    null,
    0.14,
    0.0,
    0.0,
    0.0,
    0.0,
    0.0,
    0.0,
    0.0,
    0.0,
    0.0,
    0.0,
    0.0,
    0.0,
    0.0,
    0.0,
    0.0,
    0.0,
    0.0,
    0.0,
    0.0,
    0.01,
    null,
    null
   ],
   "12": [
    null,
    null,
    0.05,
    0.0,
    0.0,
    0.0,
    0.0,
    0.0,
    0.0,
    0.0,
    0.0,
    0.0,
    0.0,
    0.0,
    0.0,
    0.0,
    0.0,
    0.0,
    0.0,
    0.0,
    0.0,
    0.0,
    null,
    null
   ],
   "2": [
    null,
    null,
    0.04,
    0.0,
    0.0,
    0.0,
    0.0,
    0.0,
    0.0,
    0.0,
    0.0,
    0.0,
    0.0,
    0.0,
    0.0,
    0.0,
    0.0,
    0.0,
    0.0,
    0.0,
    0.0,
    0.0,
    0.0,
    null
   ],
   "3": [
    null,
    0.06,
    0.0,
    0.0,
    0.0,
    0.0,
    0.0,
    0.0,
    0.0,
    0.0,
    0.0,
    0.0,
    0.0,
    0.0,
    0.0,
    0.0,
    0.0,
    0.0,
    0.0,
    0.0,
    0.0,
    0.0,
    0.0,
    0.19
   ],
   "4": [
    0.02,
    0.0,
    0.0,
    0.0,
    0.0,
    0.0,
    0.0,
    0.0,
    0.0,
    0.0,
    0.0,
    0.0,
    0.0,
    0.0,
    0.0,
    0.0,
    0.0,
    0.0,
    0.0,
    0.0,
    0.0,
    0.0,
    0.0,
    0.0
   ],
   "5": [
    0.0,
    0.0,
    0.0,
    0.0,
    0.0,
    0.0,
    0.0,
    0.0,
    0.0,
    0.0,
    0.0,
    0.0,
    0.0,
    0.0,
    0.0,
    0.0,
    0.0,
    0.0,
    0.0,
    0.0,
    0.0,
    0.0,
    0.0,
    0.0
   ],
   "6": [
    0.0,
    0.0,
    0.0,
    0.0,
    0.0,
    0.0,
    0.0,
    0.0,
    0.0,
    0.0,
    0.0,
    0.0,
    0.0,
    0.0,
    0.0,
    0.0,
    0.0,
    0.0,
    0.0,
    0.0,
    0.0,
    0.0,
    0.0,
    0.0
   ],
   "7": [
    0.0,
    0.0,
    0.0,
    0.0,
    0.0,
    0.0,
    0.0,
    0.0,
    0.0,
    0.0,
    0.0,
    0.0,
    0.0,
    0.0,
    0.0,
    0.0,
    0.0,
    0.0,
    0.0,
    0.0,
    0.0,
    0.0,
    0.0,
    0.0
   ],
   "8": [
    0.0,
    0.0,
    0.0,
    0.0,
    0.0,
    0.0,
    0.0,
    0.0,
    0.0,
    0.0,
    0.0,
    0.0,
    0.0,
    0.0,
    0.0,
    0.0,
    0.0,
    0.0,
    0.0,
    0.0,
    0.0,
    0.0,
    0.0,
    0.0
   ],
   "9": [
    0.09,
    0.0,
    0.0,
    0.0,
    0.0,
    0.0,
    0.0,
    0.0,
    0.0,
    0.0,
    0.0,
    0.0,
    0.0,
    0.0,
    0.0,
    0.0,
    0.0,
    0.0,
    0.0,
    0.0,
    0.0,
    0.0,
    0.0,
    null
   ]
  },
  "source": "https://www.openstreetmap.org/way/1291192404",
  "value": null,
  "verified_at": "2026-10-12"
 },
 "shade_types": [],
 "sources": [
  {
   "as_of": "2026-10-12T20:21:35Z",
   "license": "ODbL 1.0",
   "name": "OpenStreetMap",
   "url": "https://www.openstreetmap.org/copyright"
  }
 ],
 "updated_at": "2026-10-12"
}
