{
 "address": null,
 "amenities": {
  "drinking_water": {
   "confidence": "low",
   "distance_m": null,
   "method": "osm",
   "source": "https://data.gov.tw/dataset/136476",
   "value": null,
   "verified_at": "2026-10-12"
  },
  "toilet": {
   "changing_table": null,
   "confidence": "medium",
   "distance_m": 57,
   "method": "osm",
   "note": null,
   "source": "https://data.gov.tw/dataset/136476",
   "value": true,
   "verified_at": "2026-10-12"
  }
 },
 "area_m2": 452,
 "best_shade_windows": {
  "1": null,
  "10": null,
  "11": null,
  "12": null,
  "2": null,
  "3": null,
  "4": null,
  "5": null,
  "6": null,
  "7": null,
  "8": null,
  "9": null
 },
 "charger_summary": {
  "fast": 0,
  "nearest_any_m": 1345,
  "nearest_fast_m": null,
  "nearest_slow_m": null,
  "radius_m": 2000,
  "slow": 0,
  "total": 1,
  "unknown": 1
 },
 "chargers": [
  {
   "access": null,
   "brand": "EVALUE充電站",
   "capacity": null,
   "distance_m": 1345,
   "distance_method": "straight_line",
   "fee": null,
   "location": {
    "lat": 25.084514,
    "lng": 121.550016
   },
   "max_kw": null,
   "method": "osm",
   "name": "EVALUE充電站",
   "opening_hours": null,
   "operator": null,
   "osm": {
    "id": 14028174130,
    "type": "node",
    "url": "https://www.openstreetmap.org/node/14028174130"
   },
   "sockets": [],
   "speed": "unknown",
   "speed_label": "未標示",
   "speed_source": null,
   "verified_at": "2026-10-12"
  }
 ],
 "daytime_shaded_share": 0.0,
 "geometry_estimated": true,
 "id": "tp-o3041282775384",
 "indoor": false,
 "kind": "playground",
 "level": "none",
 "level_label": "大多曝曬",
 "location": {
  "lat": 25.085762,
  "lng": 121.536608
 },
 "name": "力行3號公園",
 "name_source": "official",
 "official": {
  "address": null,
  "distance_m": null,
  "equipment": {
   "搖搖樂": 1,
   "組合遊具": 1
  },
  "management": "圓山所",
  "method": "official_record",
  "name": "力行3號公園",
  "phone": null,
  "registry_points": 1,
  "source": "https://data.gov.tw/dataset/136476",
  "verified_at": "2026-10-13"
 },
 "osm": null,
 "park_name": "力行3號公園",
 "parking": [
  {
   "access": null,
   "capacity": null,
   "capacity_disabled": null,
   "capacity_parent": null,
   "distance_m": 727,
   "distance_method": "straight_line",
   "fee": null,
   "kind": "surface",
   "kind_label": "平面停車場",
   "location": {
    "lat": 25.079384,
    "lng": 121.533635
   },
   "maxheight_m": null,
   "method": "osm",
   "name": "平面停車場",
   "opening_hours": null,
   "operator": null,
   "osm": {
    "id": 368960215,
    "type": "way",
    "url": "https://www.openstreetmap.org/way/368960215"
   },
   "verified_at": "2026-10-12"
  },
  {
   "access": "customers",
   "capacity": null,
   "capacity_disabled": null,
   "capacity_parent": null,
   "distance_m": 728,
   "distance_method": "straight_line",
   "fee": null,
   "kind": "surface",
   "kind_label": "平面停車場",
   "location": {
    "lat": 25.079137,
    "lng": 121.53862
   },
   "maxheight_m": null,
   "method": "osm",
   "name": "平面停車場",
   "opening_hours": null,
   "operator": null,
   "osm": {
    "id": 375825433,
    "type": "way",
    "url": "https://www.openstreetmap.org/way/375825433"
   },
   "verified_at": "2026-10-12"
  },
  {
   "access": "customers",
   "capacity": null,
   "capacity_disabled": null,
   "capacity_parent": null,
   "distance_m": 760,
   "distance_method": "straight_line",
   "fee": null,
   "kind": "surface",
   "kind_label": "平面停車場",
   "location": {
    "lat": 25.083496,
    "lng": 121.544126
   },
   "maxheight_m": null,
   "method": "osm",
   "name": "國防部會客室停車場",
   "opening_hours": null,
   "operator": null,
   "osm": {
    "id": 612461523,
    "type": "way",
    "url": "https://www.openstreetmap.org/way/612461523"
   },
   "verified_at": "2026-10-12"
  },
  {
   "access": null,
   "capacity": null,
   "capacity_disabled": null,
   "capacity_parent": null,
   "distance_m": 788,
   "distance_method": "straight_line",
   "fee": null,
   "kind": "surface",
   "kind_label": "平面停車場",
   "location": {
    "lat": 25.078632,
    "lng": 121.534807
   },
   "maxheight_m": null,
   "method": "osm",
   "name": "平面停車場",
   "opening_hours": null,
   "operator": null,
   "osm": {
    "id": 368960216,
    "type": "way",
    "url": "https://www.openstreetmap.org/way/368960216"
   },
   "verified_at": "2026-10-12"
  }
 ],
 "playground": {
  "equipment": [],
  "fee": null,
  "max_age": null,
  "min_age": null,
  "opening_hours": null,
  "surface": null,
  "wheelchair": null
 },
 "playground_mapped": false,
 "rain_cover": {
  "confidence": "low",
  "covered_area_m2": 0,
  "covered_ratio": 0.0,
  "method": "osm",
  "note": "OSM 未標示覆蓋此處的高架或屋頂；未實地驗證",
  "source": "https://data.gov.tw/dataset/136476",
  "value": false,
  "verified_at": "2026-10-12"
 },
 "region": {
  "city": "臺北市",
  "district": "中山區",
  "id": "taipei"
 },
 "shade_timetable": {
  "building_height_known_share": 0.03,
  "buildings_considered": 71,
  "confidence": "low",
  "method": "computed",
  "note": "依 OSM 建物高度/樓層、高架、屋頂、樹木與太陽位置推算（每月 15 日）；未計地形與臨時遮蔽",
  "slot_minutes": 30,
  "slot_start": "06:00",
  "slots": {
   "1": [
    null,
    null,
    0.0,
    0.0,
    0.0,
    0.0,
    0.0,
    0.0,
    0.0,
    0.0,
    0.0,
    0.0,
    0.0,
    0.0,
    0.0,
    0.0,
    0.0,
    0.0,
    0.0,
    0.0,
    0.0,
    0.0,
    null,
    null
   ],
   "10": [
    0.0,
    0.0,
    0.0,
    0.0,
    0.0,
    0.0,
    0.0,
    0.0,
    0.0,
    0.0,
    0.0,
    0.0,
    0.0,
    0.0,
    0.0,
    0.0,
    0.0,
    0.0,
    0.0,
    0.0,
    0.0,
    0.0,
    null,
    null
   ],
   "11": [
    null,
    0.0,
    0.0,
    0.0,
    0.0,
    0.0,
    0.0,
    0.0,
    0.0,
    0.0,
    0.0,
    0.0,
    0.0,
    0.0,
    0.0,
    0.0,
    0.0,
    0.0,
    0.0,
    0.0,
    0.0,
    0.0,
    null,
    null
   ],
   "12": [
    null,
    null,
    0.0,
    0.0,
    0.0,
    0.0,
    0.0,
    0.0,
    0.0,
    0.0,
    0.0,
    0.0,
    0.0,
    0.0,
    0.0,
    0.0,
    0.0,
    0.0,
    0.0,
    0.0,
    0.0,
    0.0,
    null,
    null
   ],
   "2": [
    null,
    null,
    0.0,
    0.0,
    0.0,
    0.0,
    0.0,
    0.0,
    0.0,
    0.0,
    0.0,
    0.0,
    0.0,
    0.0,
    0.0,
    0.0,
    0.0,
    0.0,
    0.0,
    0.0,
    0.0,
    0.0,
    0.0,
    null
   ],
   "3": [
    null,
    0.0,
    0.0,
    0.0,
    0.0,
    0.0,
    0.0,
    0.0,
    0.0,
    0.0,
    0.0,
    0.0,
    0.0,
    0.0,
    0.0,
    0.0,
    0.0,
    0.0,
    0.0,
    0.0,
    0.0,
    0.0,
    0.0,
    0.0
   ],
   "4": [
    0.0,
    0.0,
    0.0,
    0.0,
    0.0,
    0.0,
    0.0,
    0.0,
    0.0,
    0.0,
    0.0,
    0.0,
    0.0,
    0.0,
    0.0,
    0.0,
    0.0,
    0.0,
    0.0,
    0.0,
    0.0,
    0.0,
    0.0,
    0.0
   ],
   "5": [
    0.0,
    0.0,
    0.0,
    0.0,
    0.0,
    0.0,
    0.0,
    0.0,
    0.0,
    0.0,
    0.0,
    0.0,
    0.0,
    0.0,
    0.0,
    0.0,
    0.0,
    0.0,
    0.0,
    0.0,
    0.0,
    0.0,
    0.0,
    0.0
   ],
   "6": [
    0.0,
    0.0,
    0.0,
    0.0,
    0.0,
    0.0,
    0.0,
    0.0,
    0.0,
    0.0,
    0.0,
    0.0,
    0.0,
    0.0,
    0.0,
    0.0,
    0.0,
    0.0,
    0.0,
    0.0,
    0.0,
    0.0,
    0.0,
    0.0
   ],
   "7": [
    0.0,
    0.0,
    0.0,
    0.0,
    0.0,
    0.0,
    0.0,
    0.0,
    0.0,
    0.0,
    0.0,
    0.0,
    0.0,
    0.0,
    0.0,
    0.0,
    0.0,
    0.0,
    0.0,
    0.0,
    0.0,
    0.0,
    0.0,
    0.0
   ],
   "8": [
    0.0,
    0.0,
    0.0,
    0.0,
    0.0,
    0.0,
    0.0,
    0.0,
    0.0,
    0.0,
    0.0,
    0.0,
    0.0,
    0.0,
    0.0,
    0.0,
    0.0,
    0.0,
    0.0,
    0.0,
    0.0,
    0.0,
    0.0,
    0.0
   ],
   "9": [
    0.0,
    0.0,
    0.0,
    0.0,
    0.0,
    0.0,
    0.0,
    0.0,
    0.0,
    0.0,
    0.0,
    0.0,
    0.0,
    0.0,
    0.0,
    0.0,
    0.0,
    0.0,
    0.0,
    0.0,
    0.0,
    0.0,
    0.0,
    null
   ]
  },
  "source": "https://data.gov.tw/dataset/136476",
  "value": null,
  "verified_at": "2026-10-12"
 },
 "shade_types": [],
 "sources": [
  {
   "as_of": "2026-10-12T20:21:35Z",
   "license": "ODbL 1.0",
   "name": "OpenStreetMap",
   "url": "https://www.openstreetmap.org/copyright"
  },
  {
   "as_of": "2026-10-13T04:50:48+00:00",
   "license": "政府資料開放授權條款第1版（相容 CC BY 4.0）",
   "name": "臺北市政府工務局公園路燈工程管理處「臺北市公園設施資料（兒童遊戲場）」",
   "url": "https://data.gov.tw/dataset/136476"
  }
 ],
 "updated_at": "2026-10-12"
}
