{
 "address": null,
 "amenities": {
  "convenience_store": {
   "confidence": "medium",
   "distance_m": 61,
   "location": {
    "lat": 24.830195,
    "lng": 120.928482
   },
   "method": "osm",
   "name": "萊爾富",
   "source": "https://www.openstreetmap.org/node/13304782553",
   "value": true,
   "verified_at": "2026-10-24"
  },
  "drinking_water": {
   "confidence": "low",
   "distance_m": null,
   "location": null,
   "method": "osm",
   "source": "https://www.openstreetmap.org/way/361375363",
   "value": null,
   "verified_at": "2026-10-24"
  },
  "station": {
   "confidence": "low",
   "distance_m": null,
   "location": null,
   "method": "osm",
   "name": null,
   "source": "https://www.openstreetmap.org/way/361375363",
   "value": null,
   "verified_at": "2026-10-24"
  },
  "toilet": {
   "changing_table": null,
   "confidence": "low",
   "distance_m": null,
   "method": "osm",
   "note": "300m 內沒有登記或標示的公廁；不代表沒有",
   "source": "https://www.openstreetmap.org/way/361375363",
   "value": null,
   "verified_at": "2026-10-24"
  }
 },
 "area_m2": 1715,
 "best_shade_windows": {
  "1": {
   "end": "08:00",
   "end_slot": 4,
   "mean": 0.8,
   "start": "07:00",
   "start_slot": 2
  },
  "10": null,
  "11": {
   "end": "07:30",
   "end_slot": 3,
   "mean": 0.79,
   "start": "06:30",
   "start_slot": 1
  },
  "12": {
   "end": "07:30",
   "end_slot": 3,
   "mean": 0.76,
   "start": "07:00",
   "start_slot": 2
  },
  "2": null,
  "3": null,
  "4": null,
  "5": null,
  "6": null,
  "7": null,
  "8": null,
  "9": null
 },
 "charger_summary": {
  "fast": 0,
  "nearest_any_m": null,
  "nearest_fast_m": null,
  "nearest_slow_m": null,
  "radius_m": 500,
  "slow": 0,
  "total": 0,
  "unknown": 0
 },
 "chargers": [],
 "daytime_shaded_share": 0.0,
 "geometry_estimated": false,
 "id": "hc-w361375363",
 "indoor": false,
 "kind": "playground",
 "level": "none",
 "level_label": "大多曝曬",
 "location": {
  "lat": 24.830349,
  "lng": 120.927675
 },
 "name": "港北崇和公園",
 "name_source": "osm_name",
 "official": {
  "address": null,
  "distance_m": null,
  "equipment": null,
  "facilities": "組合遊具組溜滑梯1組、雙人搖搖馬1組、地景雙人滑梯1組、平衡木1組",
  "features": null,
  "management": "新竹市政府養護工程處",
  "method": "name_match",
  "name": "港北崇和公園",
  "phone": null,
  "registry_points": 1,
  "source": "https://data.gov.tw/dataset/132713",
  "verified_at": "2026-10-14"
 },
 "osm": {
  "id": 361375363,
  "type": "way",
  "url": "https://www.openstreetmap.org/way/361375363"
 },
 "park_name": "港北崇和公園",
 "parking": [
  {
   "access": null,
   "capacity": null,
   "capacity_disabled": null,
   "capacity_parent": null,
   "distance_m": 440,
   "distance_method": "straight_line",
   "fee": null,
   "kind": null,
   "kind_label": "停車場",
   "location": {
    "lat": 24.834569,
    "lng": 120.929038
   },
   "maxheight_m": null,
   "method": "osm",
   "name": "停車場",
   "opening_hours": null,
   "operator": null,
   "osm": {
    "id": 1009481011,
    "type": "way",
    "url": "https://www.openstreetmap.org/way/1009481011"
   },
   "verified_at": "2026-10-24"
  }
 ],
 "playground": {
  "equipment": [],
  "fee": null,
  "max_age": null,
  "min_age": null,
  "opening_hours": null,
  "surface": null,
  "wheelchair": null
 },
 "playground_mapped": false,
 "rain_cover": {
  "confidence": "low",
  "covered_area_m2": 5,
  "covered_ratio": 0.0,
  "method": "computed",
  "note": "OSM 未標示覆蓋此處的高架或屋頂；未實地驗證",
  "source": "https://www.openstreetmap.org/way/361375363",
  "value": false,
  "verified_at": "2026-10-24"
 },
 "region": {
  "city": "新竹市",
  "district": "北區",
  "id": "hsinchucity"
 },
 "shade_timetable": {
  "building_height_known_share": 0.0,
  "buildings_considered": 10,
  "confidence": "low",
  "method": "computed",
  "note": "依 OSM 建物高度/樓層、高架、屋頂、樹木與太陽位置推算（每月 15 日）；未計地形與臨時遮蔽",
  "slot_minutes": 30,
  "slot_start": "06:00",
  "slots": {
   "1": [
    null,
    null,
    0.85,
    0.76,
    0.21,
    0.19,
    0.18,
    0.17,
    0.16,
    0.16,
    0.15,
    0.15,
    0.14,
    0.14,
    0.14,
    0.15,
    0.15,
    0.16,
    0.16,
    0.17,
    0.17,
    0.17,
    null,
    null
   ],
   "10": [
    0.28,
    0.24,
    0.21,
    0.21,
    0.2,
    0.19,
    0.18,
    0.17,
    0.16,
    0.15,
    0.15,
    0.14,
    0.14,
    0.14,
    0.15,
    0.16,
    0.16,
    0.17,
    0.18,
    0.18,
    0.19,
    0.18,
    null,
    null
   ],
   "11": [
    null,
    0.77,
    0.82,
    0.2,
    0.19,
    0.18,
    0.17,
    0.17,
    0.16,
    0.15,
    0.15,
    0.14,
    0.14,
    0.14,
    0.15,
    0.15,
    0.16,
    0.16,
    0.17,
    0.17,
    0.18,
    0.18,
    null,
    null
   ],
   "12": [
    null,
    null,
    0.76,
    0.5,
    0.19,
    0.18,
    0.17,
    0.17,
    0.16,
    0.15,
    0.15,
    0.14,
    0.14,
    0.14,
    0.14,
    0.15,
    0.15,
    0.16,
    0.16,
    0.17,
    0.17,
    0.17,
    null,
    null
   ],
   "2": [
    null,
    null,
    0.45,
    0.33,
    0.21,
    0.2,
    0.19,
    0.18,
    0.17,
    0.16,
    0.15,
    0.15,
    0.14,
    0.14,
    0.14,
    0.15,
    0.15,
    0.16,
    0.17,
    0.17,
    0.18,
    0.18,
    0.18,
    null
   ],
   "3": [
    null,
    0.23,
    0.21,
    0.19,
    0.21,
    0.2,
    0.18,
    0.17,
    0.16,
    0.16,
    0.15,
    0.14,
    0.14,
    0.14,
    0.15,
    0.15,
    0.16,
    0.17,
    0.18,
    0.18,
    0.19,
    0.19,
    0.19,
    0.19
   ],
   "4": [
    0.3,
    0.28,
    0.25,
    0.23,
    0.2,
    0.17,
    0.16,
    0.16,
    0.16,
    0.15,
    0.15,
    0.14,
    0.14,
    0.14,
    0.15,
    0.16,
    0.16,
    0.17,
    0.18,
    0.19,
    0.2,
    0.2,
    0.2,
    0.19
   ],
   "5": [
    0.35,
    0.31,
    0.28,
    0.25,
    0.21,
    0.19,
    0.17,
    0.15,
    0.14,
    0.13,
    0.13,
    0.13,
    0.13,
    0.14,
    0.15,
    0.16,
    0.17,
    0.17,
    0.18,
    0.19,
    0.19,
    0.18,
    0.18,
    0.19
   ],
   "6": [
    0.37,
    0.33,
    0.29,
    0.26,
    0.22,
    0.2,
    0.18,
    0.16,
    0.15,
    0.14,
    0.13,
    0.12,
    0.12,
    0.13,
    0.14,
    0.15,
    0.15,
    0.16,
    0.17,
    0.18,
    0.18,
    0.18,
    0.2,
    0.22
   ],
   "7": [
    0.37,
    0.34,
    0.3,
    0.26,
    0.23,
    0.2,
    0.18,
    0.16,
    0.15,
    0.13,
    0.13,
    0.12,
    0.13,
    0.13,
    0.14,
    0.15,
    0.16,
    0.16,
    0.17,
    0.18,
    0.18,
    0.18,
    0.19,
    0.2
   ],
   "8": [
    0.33,
    0.31,
    0.27,
    0.24,
    0.21,
    0.18,
    0.16,
    0.15,
    0.14,
    0.14,
    0.14,
    0.14,
    0.14,
    0.14,
    0.15,
    0.16,
    0.16,
    0.17,
    0.18,
    0.2,
    0.2,
    0.2,
    0.2,
    0.18
   ],
   "9": [
    0.27,
    0.25,
    0.22,
    0.2,
    0.19,
    0.18,
    0.18,
    0.17,
    0.16,
    0.15,
    0.15,
    0.14,
    0.14,
    0.14,
    0.15,
    0.16,
    0.16,
    0.17,
    0.18,
    0.19,
    0.19,
    0.2,
    0.19,
    null
   ]
  },
  "source": "https://www.openstreetmap.org/way/361375363",
  "value": null,
  "verified_at": "2026-10-24"
 },
 "shade_types": [
  {
   "confidence": "medium",
   "covered_ratio": 0.0,
   "level": "B",
   "method": "computed",
   "osm": [
    {
     "id": 1559223991,
     "type": "way",
     "url": "https://www.openstreetmap.org/way/1559223991"
    }
   ],
   "rain_proof": true,
   "source": "https://www.openstreetmap.org/way/361375363",
   "type": "pavilion",
   "value": true,
   "verified_at": "2026-10-24"
  }
 ],
 "sources": [
  {
   "as_of": "2026-10-24T20:20:51Z",
   "license": "ODbL 1.0",
   "name": "OpenStreetMap",
   "url": "https://www.openstreetmap.org/copyright"
  },
  {
   "as_of": "2026-10-14T17:21:37+00:00",
   "license": "政府資料開放授權條款第1版（相容 CC BY 4.0）",
   "name": "新竹市政府養護工程處「新竹市兒童遊戲場清冊」",
   "url": "https://data.gov.tw/dataset/132713"
  }
 ],
 "updated_at": "2026-10-24"
}
