{
 "address": null,
 "amenities": {
  "convenience_store": {
   "confidence": "medium",
   "distance_m": 242,
   "method": "osm",
   "name": "全家便利商店",
   "source": "https://www.openstreetmap.org/node/3433281093",
   "value": true,
   "verified_at": "2026-10-13"
  },
  "drinking_water": {
   "confidence": "low",
   "distance_m": null,
   "method": "osm",
   "source": "https://www.openstreetmap.org/way/215354941",
   "value": null,
   "verified_at": "2026-10-13"
  },
  "station": {
   "confidence": "medium",
   "distance_m": 1135,
   "method": "osm",
   "name": "捷運新店站",
   "source": "https://www.openstreetmap.org/node/3461854239",
   "value": true,
   "verified_at": "2026-10-13"
  },
  "toilet": {
   "accessible": null,
   "category": null,
   "changing_table": null,
   "confidence": "medium",
   "distance_m": 39,
   "family": null,
   "family_room": null,
   "method": "osm",
   "name": null,
   "source": "https://www.openstreetmap.org/node/2238453412",
   "value": true,
   "verified_at": "2026-10-13"
  }
 },
 "area_m2": 376,
 "best_shade_windows": {
  "1": null,
  "10": null,
  "11": {
   "end": "17:00",
   "end_slot": 22,
   "mean": 1.0,
   "start": "16:30",
   "start_slot": 21
  },
  "12": {
   "end": "17:00",
   "end_slot": 22,
   "mean": 1.0,
   "start": "16:30",
   "start_slot": 21
  },
  "2": {
   "end": "17:30",
   "end_slot": 23,
   "mean": 0.69,
   "start": "17:00",
   "start_slot": 22
  },
  "3": {
   "end": "18:00",
   "end_slot": 24,
   "mean": 1.0,
   "start": "17:30",
   "start_slot": 23
  },
  "4": {
   "end": "18:00",
   "end_slot": 24,
   "mean": 1.0,
   "start": "17:30",
   "start_slot": 23
  },
  "5": null,
  "6": null,
  "7": null,
  "8": null,
  "9": null
 },
 "charger_summary": {
  "fast": 0,
  "nearest_any_m": null,
  "nearest_fast_m": null,
  "nearest_slow_m": null,
  "radius_m": 500,
  "slow": 0,
  "total": 0,
  "unknown": 0
 },
 "chargers": [],
 "daytime_shaded_share": 0.0,
 "geometry_estimated": false,
 "id": "nt-w215354941",
 "indoor": false,
 "kind": "park",
 "level": "none",
 "level_label": "大多曝曬",
 "location": {
  "lat": 24.948957,
  "lng": 121.532203
 },
 "name": "紅蝶戲谷",
 "name_source": "osm_name",
 "official": null,
 "osm": {
  "id": 215354941,
  "type": "way",
  "url": "https://www.openstreetmap.org/way/215354941"
 },
 "park_name": "紅蝶戲谷",
 "parking": [
  {
   "access": null,
   "capacity": null,
   "capacity_disabled": null,
   "capacity_parent": null,
   "distance_m": 38,
   "distance_method": "straight_line",
   "fee": null,
   "kind": "surface",
   "kind_label": "平面停車場",
   "location": {
    "lat": 24.948912,
    "lng": 121.5315
   },
   "maxheight_m": null,
   "method": "osm",
   "name": "平面停車場",
   "opening_hours": null,
   "operator": null,
   "osm": {
    "id": 325972586,
    "type": "way",
    "url": "https://www.openstreetmap.org/way/325972586"
   },
   "verified_at": "2026-10-13"
  },
  {
   "access": null,
   "capacity": 79,
   "capacity_disabled": "2",
   "capacity_parent": null,
   "distance_m": 632,
   "distance_method": "straight_line",
   "fee": "yes",
   "kind": "surface",
   "kind_label": "平面停車場",
   "location": {
    "lat": 24.952338,
    "lng": 121.537788
   },
   "maxheight_m": null,
   "method": "osm",
   "name": "碧潭渡船頭停車場",
   "opening_hours": "24/7",
   "operator": "日月亭股份有限公司",
   "osm": {
    "id": 327794533,
    "type": "way",
    "url": "https://www.openstreetmap.org/way/327794533"
   },
   "verified_at": "2026-10-13"
  }
 ],
 "playground": {
  "equipment": [],
  "fee": null,
  "max_age": null,
  "min_age": null,
  "opening_hours": null,
  "surface": null,
  "wheelchair": null
 },
 "playground_mapped": false,
 "rain_cover": {
  "confidence": "low",
  "covered_area_m2": 0,
  "covered_ratio": 0.0,
  "method": "osm",
  "note": "OSM 未標示覆蓋此處的高架或屋頂；未實地驗證",
  "source": "https://www.openstreetmap.org/way/215354941",
  "value": false,
  "verified_at": "2026-10-13"
 },
 "region": {
  "city": "新北市",
  "district": "新店區",
  "id": "newtaipei"
 },
 "shade_timetable": {
  "building_height_known_share": 0.0,
  "buildings_considered": 109,
  "confidence": "low",
  "method": "computed",
  "note": "依 OSM 建物高度/樓層、高架、屋頂、樹木與太陽位置推算（每月 15 日）；未計地形與臨時遮蔽",
  "slot_minutes": 30,
  "slot_start": "06:00",
  "slots": {
   "1": [
    null,
    null,
    0.0,
    0.0,
    0.0,
    0.0,
    0.0,
    0.0,
    0.0,
    0.0,
    0.0,
    0.0,
    0.0,
    0.0,
    0.0,
    0.0,
    0.0,
    0.0,
    0.0,
    0.01,
    0.27,
    0.41,
    null,
    null
   ],
   "10": [
    0.0,
    0.0,
    0.0,
    0.0,
    0.0,
    0.0,
    0.0,
    0.0,
    0.0,
    0.0,
    0.0,
    0.0,
    0.0,
    0.0,
    0.0,
    0.0,
    0.0,
    0.0,
    0.0,
    0.05,
    0.3,
    0.34,
    null,
    null
   ],
   "11": [
    null,
    0.0,
    0.0,
    0.0,
    0.0,
    0.0,
    0.0,
    0.0,
    0.0,
    0.0,
    0.0,
    0.0,
    0.0,
    0.0,
    0.0,
    0.0,
    0.0,
    0.0,
    0.0,
    0.16,
    0.42,
    1.0,
    null,
    null
   ],
   "12": [
    null,
    null,
    0.0,
    0.0,
    0.0,
    0.0,
    0.0,
    0.0,
    0.0,
    0.0,
    0.0,
    0.0,
    0.0,
    0.0,
    0.0,
    0.0,
    0.0,
    0.0,
    0.0,
    0.13,
    0.34,
    1.0,
    null,
    null
   ],
   "2": [
    null,
    null,
    0.0,
    0.0,
    0.0,
    0.0,
    0.0,
    0.0,
    0.0,
    0.0,
    0.0,
    0.0,
    0.0,
    0.0,
    0.0,
    0.0,
    0.0,
    0.0,
    0.0,
    0.0,
    0.09,
    0.38,
    0.69,
    null
   ],
   "3": [
    null,
    0.0,
    0.0,
    0.0,
    0.0,
    0.0,
    0.0,
    0.0,
    0.0,
    0.0,
    0.0,
    0.0,
    0.0,
    0.0,
    0.0,
    0.0,
    0.0,
    0.0,
    0.0,
    0.0,
    0.05,
    0.26,
    0.29,
    1.0
   ],
   "4": [
    0.0,
    0.0,
    0.0,
    0.0,
    0.0,
    0.0,
    0.0,
    0.0,
    0.0,
    0.0,
    0.0,
    0.0,
    0.0,
    0.0,
    0.0,
    0.0,
    0.0,
    0.0,
    0.0,
    0.0,
    0.03,
    0.15,
    0.15,
    1.0
   ],
   "5": [
    0.0,
    0.0,
    0.0,
    0.0,
    0.0,
    0.0,
    0.0,
    0.0,
    0.0,
    0.0,
    0.0,
    0.0,
    0.0,
    0.0,
    0.0,
    0.0,
    0.0,
    0.0,
    0.0,
    0.0,
    0.0,
    0.03,
    0.04,
    0.07
   ],
   "6": [
    0.0,
    0.0,
    0.0,
    0.0,
    0.0,
    0.0,
    0.0,
    0.0,
    0.0,
    0.0,
    0.0,
    0.0,
    0.0,
    0.0,
    0.0,
    0.0,
    0.0,
    0.0,
    0.0,
    0.0,
    0.0,
    0.0,
    0.0,
    0.0
   ],
   "7": [
    0.0,
    0.0,
    0.0,
    0.0,
    0.0,
    0.0,
    0.0,
    0.0,
    0.0,
    0.0,
    0.0,
    0.0,
    0.0,
    0.0,
    0.0,
    0.0,
    0.0,
    0.0,
    0.0,
    0.0,
    0.0,
    0.0,
    0.01,
    0.0
   ],
   "8": [
    0.0,
    0.0,
    0.0,
    0.0,
    0.0,
    0.0,
    0.0,
    0.0,
    0.0,
    0.0,
    0.0,
    0.0,
    0.0,
    0.0,
    0.0,
    0.0,
    0.0,
    0.0,
    0.0,
    0.0,
    0.01,
    0.07,
    0.11,
    0.08
   ],
   "9": [
    0.0,
    0.0,
    0.0,
    0.0,
    0.0,
    0.0,
    0.0,
    0.0,
    0.0,
    0.0,
    0.0,
    0.0,
    0.0,
    0.0,
    0.0,
    0.0,
    0.0,
    0.0,
    0.0,
    0.0,
    0.09,
    0.26,
    0.23,
    null
   ]
  },
  "source": "https://www.openstreetmap.org/way/215354941",
  "value": null,
  "verified_at": "2026-10-13"
 },
 "shade_types": [],
 "sources": [
  {
   "as_of": "2026-10-13T20:21:31Z",
   "license": "ODbL 1.0",
   "name": "OpenStreetMap",
   "url": "https://www.openstreetmap.org/copyright"
  }
 ],
 "updated_at": "2026-10-13"
}
