{
 "address": null,
 "amenities": {
  "drinking_water": {
   "confidence": "low",
   "distance_m": null,
   "method": "osm",
   "source": "https://www.openstreetmap.org/way/254615928",
   "value": null,
   "verified_at": "2026-10-12"
  },
  "toilet": {
   "changing_table": null,
   "confidence": "medium",
   "distance_m": 51,
   "method": "osm",
   "note": null,
   "source": "https://www.openstreetmap.org/way/254615928",
   "value": true,
   "verified_at": "2026-10-12"
  }
 },
 "area_m2": 401,
 "best_shade_windows": {
  "1": {
   "end": "09:30",
   "end_slot": 7,
   "mean": 0.87,
   "start": "07:00",
   "start_slot": 2
  },
  "10": {
   "end": "08:30",
   "end_slot": 5,
   "mean": 0.78,
   "start": "06:00",
   "start_slot": 0
  },
  "11": {
   "end": "09:00",
   "end_slot": 6,
   "mean": 0.85,
   "start": "06:30",
   "start_slot": 1
  },
  "12": {
   "end": "09:00",
   "end_slot": 6,
   "mean": 0.94,
   "start": "07:00",
   "start_slot": 2
  },
  "2": {
   "end": "09:00",
   "end_slot": 6,
   "mean": 0.83,
   "start": "07:00",
   "start_slot": 2
  },
  "3": {
   "end": "07:30",
   "end_slot": 3,
   "mean": 0.79,
   "start": "06:30",
   "start_slot": 1
  },
  "4": {
   "end": "06:30",
   "end_slot": 1,
   "mean": 1.0,
   "start": "06:00",
   "start_slot": 0
  },
  "5": {
   "end": "07:00",
   "end_slot": 2,
   "mean": 0.7,
   "start": "06:00",
   "start_slot": 0
  },
  "6": {
   "end": "07:30",
   "end_slot": 3,
   "mean": 0.7,
   "start": "06:00",
   "start_slot": 0
  },
  "7": {
   "end": "07:30",
   "end_slot": 3,
   "mean": 0.76,
   "start": "06:00",
   "start_slot": 0
  },
  "8": {
   "end": "07:00",
   "end_slot": 2,
   "mean": 0.81,
   "start": "06:00",
   "start_slot": 0
  },
  "9": {
   "end": "06:30",
   "end_slot": 1,
   "mean": 1.0,
   "start": "06:00",
   "start_slot": 0
  }
 },
 "charger_summary": {
  "fast": 0,
  "nearest_any_m": null,
  "nearest_fast_m": null,
  "nearest_slow_m": null,
  "radius_m": 500,
  "slow": 0,
  "total": 0,
  "unknown": 0
 },
 "chargers": [],
 "daytime_shaded_share": 0.01,
 "geometry_estimated": false,
 "id": "ty-w254615928",
 "indoor": false,
 "kind": "park",
 "level": "none",
 "level_label": "大多曝曬",
 "location": {
  "lat": 25.01938,
  "lng": 121.292154
 },
 "name": "瑞慶公園",
 "name_source": "osm_name",
 "official": null,
 "osm": {
  "id": 254615928,
  "type": "way",
  "url": "https://www.openstreetmap.org/way/254615928"
 },
 "park_name": "瑞慶公園",
 "parking": [
  {
   "access": null,
   "capacity": null,
   "capacity_disabled": null,
   "capacity_parent": null,
   "distance_m": 0,
   "distance_method": "straight_line",
   "fee": null,
   "kind": null,
   "kind_label": "停車場",
   "location": {
    "lat": 25.01938,
    "lng": 121.291932
   },
   "maxheight_m": null,
   "method": "osm",
   "name": "停車場",
   "opening_hours": null,
   "operator": null,
   "osm": {
    "id": 883164799,
    "type": "way",
    "url": "https://www.openstreetmap.org/way/883164799"
   },
   "verified_at": "2026-10-12"
  },
  {
   "access": "customers",
   "capacity": 30,
   "capacity_disabled": "2",
   "capacity_parent": null,
   "distance_m": 93,
   "distance_method": "straight_line",
   "fee": "yes",
   "kind": "surface",
   "kind_label": "平面停車場",
   "location": {
    "lat": 25.019016,
    "lng": 121.29329
   },
   "maxheight_m": null,
   "method": "osm",
   "name": "平面停車場",
   "opening_hours": null,
   "operator": null,
   "osm": {
    "id": 883238641,
    "type": "way",
    "url": "https://www.openstreetmap.org/way/883238641"
   },
   "verified_at": "2026-10-12"
  },
  {
   "access": "yes",
   "capacity": 250,
   "capacity_disabled": null,
   "capacity_parent": null,
   "distance_m": 93,
   "distance_method": "straight_line",
   "fee": "yes",
   "kind": "surface",
   "kind_label": "平面停車場",
   "location": {
    "lat": 25.020623,
    "lng": 121.291425
   },
   "maxheight_m": null,
   "method": "osm",
   "name": "平面停車場",
   "opening_hours": null,
   "operator": null,
   "osm": {
    "id": 231978304,
    "type": "way",
    "url": "https://www.openstreetmap.org/way/231978304"
   },
   "verified_at": "2026-10-12"
  },
  {
   "access": null,
   "capacity": null,
   "capacity_disabled": null,
   "capacity_parent": null,
   "distance_m": 202,
   "distance_method": "straight_line",
   "fee": null,
   "kind": null,
   "kind_label": "停車場",
   "location": {
    "lat": 25.018867,
    "lng": 121.294417
   },
   "maxheight_m": null,
   "method": "osm",
   "name": "停車場",
   "opening_hours": null,
   "operator": null,
   "osm": {
    "id": 254620399,
    "type": "way",
    "url": "https://www.openstreetmap.org/way/254620399"
   },
   "verified_at": "2026-10-12"
  },
  {
   "access": "yes",
   "capacity": null,
   "capacity_disabled": null,
   "capacity_parent": null,
   "distance_m": 302,
   "distance_method": "straight_line",
   "fee": "yes",
   "kind": "surface",
   "kind_label": "平面停車場",
   "location": {
    "lat": 25.021394,
    "lng": 121.289533
   },
   "maxheight_m": null,
   "method": "osm",
   "name": "Times",
   "opening_hours": null,
   "operator": "台灣普客二四股份有限公司",
   "osm": {
    "id": 1040732278,
    "type": "way",
    "url": "https://www.openstreetmap.org/way/1040732278"
   },
   "verified_at": "2026-10-12"
  },
  {
   "access": null,
   "capacity": null,
   "capacity_disabled": null,
   "capacity_parent": null,
   "distance_m": 333,
   "distance_method": "straight_line",
   "fee": "yes",
   "kind": "surface",
   "kind_label": "平面停車場",
   "location": {
    "lat": 25.021147,
    "lng": 121.295596
   },
   "maxheight_m": null,
   "method": "osm",
   "name": "Times",
   "opening_hours": null,
   "operator": "台灣普客二四股份有限公司",
   "osm": {
    "id": 1040449617,
    "type": "way",
    "url": "https://www.openstreetmap.org/way/1040449617"
   },
   "verified_at": "2026-10-12"
  }
 ],
 "playground": {
  "equipment": [],
  "fee": null,
  "max_age": null,
  "min_age": null,
  "opening_hours": null,
  "surface": null,
  "wheelchair": null
 },
 "playground_mapped": false,
 "rain_cover": {
  "confidence": "low",
  "covered_area_m2": 0,
  "covered_ratio": 0.0,
  "method": "osm",
  "note": "OSM 未標示覆蓋此處的高架或屋頂；未實地驗證",
  "source": "https://www.openstreetmap.org/way/254615928",
  "value": false,
  "verified_at": "2026-10-12"
 },
 "region": {
  "city": "桃園市",
  "district": "桃園區",
  "id": "taoyuan"
 },
 "shade_timetable": {
  "building_height_known_share": 0.14,
  "buildings_considered": 336,
  "confidence": "low",
  "method": "computed",
  "note": "依 OSM 建物高度/樓層、高架、屋頂、樹木與太陽位置推算（每月 15 日）；未計地形與臨時遮蔽",
  "slot_minutes": 30,
  "slot_start": "06:00",
  "slots": {
   "1": [
    null,
    null,
    1.0,
    1.0,
    0.93,
    0.81,
    0.62,
    0.25,
    0.09,
    0.0,
    0.0,
    0.0,
    0.0,
    0.0,
    0.0,
    0.0,
    0.0,
    0.0,
    0.0,
    0.0,
    0.54,
    0.91,
    null,
    null
   ],
   "10": [
    1.0,
    0.81,
    0.84,
    0.63,
    0.6,
    0.46,
    0.25,
    0.09,
    0.0,
    0.0,
    0.0,
    0.0,
    0.0,
    0.0,
    0.0,
    0.0,
    0.0,
    0.0,
    0.0,
    0.0,
    0.14,
    0.9,
    null,
    null
   ],
   "11": [
    null,
    1.0,
    1.0,
    0.87,
    0.77,
    0.61,
    0.28,
    0.11,
    0.0,
    0.0,
    0.0,
    0.0,
    0.0,
    0.0,
    0.0,
    0.0,
    0.0,
    0.0,
    0.0,
    0.44,
    0.6,
    0.84,
    null,
    null
   ],
   "12": [
    null,
    null,
    1.0,
    1.0,
    0.93,
    0.81,
    0.46,
    0.18,
    0.03,
    0.0,
    0.0,
    0.0,
    0.0,
    0.0,
    0.0,
    0.0,
    0.0,
    0.0,
    0.0,
    0.58,
    0.77,
    0.96,
    null,
    null
   ],
   "2": [
    null,
    null,
    0.93,
    1.0,
    0.72,
    0.66,
    0.48,
    0.26,
    0.09,
    0.0,
    0.0,
    0.0,
    0.0,
    0.0,
    0.0,
    0.0,
    0.0,
    0.0,
    0.0,
    0.0,
    0.01,
    0.23,
    0.98,
    null
   ],
   "3": [
    null,
    0.89,
    0.68,
    0.53,
    0.52,
    0.5,
    0.38,
    0.19,
    0.04,
    0.0,
    0.0,
    0.0,
    0.0,
    0.0,
    0.0,
    0.0,
    0.0,
    0.0,
    0.0,
    0.0,
    0.0,
    0.0,
    0.69,
    0.87
   ],
   "4": [
    1.0,
    0.56,
    0.51,
    0.5,
    0.49,
    0.47,
    0.27,
    0.1,
    0.0,
    0.0,
    0.0,
    0.0,
    0.0,
    0.0,
    0.0,
    0.0,
    0.0,
    0.0,
    0.0,
    0.0,
    0.0,
    0.05,
    0.44,
    0.79
   ],
   "5": [
    0.76,
    0.64,
    0.58,
    0.55,
    0.53,
    0.39,
    0.2,
    0.05,
    0.0,
    0.0,
    0.0,
    0.0,
    0.0,
    0.0,
    0.0,
    0.0,
    0.0,
    0.0,
    0.0,
    0.0,
    0.0,
    0.25,
    0.45,
    0.9
   ],
   "6": [
    0.8,
    0.68,
    0.62,
    0.58,
    0.55,
    0.4,
    0.21,
    0.05,
    0.0,
    0.0,
    0.0,
    0.0,
    0.0,
    0.0,
    0.0,
    0.0,
    0.0,
    0.0,
    0.0,
    0.0,
    0.0,
    0.24,
    0.6,
    0.94
   ],
   "7": [
    0.97,
    0.69,
    0.62,
    0.58,
    0.55,
    0.45,
    0.25,
    0.08,
    0.0,
    0.0,
    0.0,
    0.0,
    0.0,
    0.0,
    0.0,
    0.0,
    0.0,
    0.0,
    0.0,
    0.0,
    0.0,
    0.17,
    0.51,
    0.91
   ],
   "8": [
    1.0,
    0.62,
    0.56,
    0.53,
    0.51,
    0.48,
    0.27,
    0.1,
    0.01,
    0.0,
    0.0,
    0.0,
    0.0,
    0.0,
    0.0,
    0.0,
    0.0,
    0.0,
    0.0,
    0.0,
    0.0,
    0.09,
    0.25,
    0.79
   ],
   "9": [
    1.0,
    0.5,
    0.49,
    0.48,
    0.47,
    0.45,
    0.27,
    0.1,
    0.0,
    0.0,
    0.0,
    0.0,
    0.0,
    0.0,
    0.0,
    0.0,
    0.0,
    0.0,
    0.0,
    0.0,
    0.0,
    0.0,
    0.75,
    null
   ]
  },
  "source": "https://www.openstreetmap.org/way/254615928",
  "value": null,
  "verified_at": "2026-10-12"
 },
 "shade_types": [],
 "sources": [
  {
   "as_of": "2026-10-12T20:21:35Z",
   "license": "ODbL 1.0",
   "name": "OpenStreetMap",
   "url": "https://www.openstreetmap.org/copyright"
  }
 ],
 "updated_at": "2026-10-12"
}
